<!--
  mapper.dtd May 2005
 
  Copyright (C) 2005, Niall Gallagher <niallg@users.sf.net>
 
  This library is free software; you can redistribute it and/or
  modify it under the terms of the GNU Lesser General Public
  License as published by the Free Software Foundation.
 
  This library is distributed in the hope that it will be useful,
  but WITHOUT ANY WARRANTY; without even the implied warranty of
  MERCHANTABILITY or FITNESS FOR A PARTICULAR PURPOSE.  See the 
  GNU Lesser General Public License for more details.
 
  You should have received a copy of the GNU Lesser General 
  Public License along with this library; if not, write to the 
  Free Software Foundation, Inc., 59 Temple Place, Suite 330, 
  Boston, MA  02111-1307  USA
-->

<?xml version="1.0" encoding="UTF-8"?>

<!ELEMENT mapper (resolve*)>

<!ELEMENT resolve (#PCDATA)>

<!ATTLIST resolve match CDATA #REQUIRED name CDATA #REQUIRED type CDATA #REQUIRED>
