<?xml version="1.0"?>
<!DOCTYPE mapper SYSTEM "http://www.simpleframework.org/dtd/mapper.dtd">
<mapper>

   <resolve match="/*" name="testFile1" type="simple.test.TestFile1"/>
   <resolve match="*/" name="testFile2" type="simple.test.TestFile2"/>
   <resolve match="/*.vm" name="testDisplay1" type="simple.test.TestDisplay1"/>
   <resolve match="/*.VM" name="testDisplay1" type="simple.test.TestDisplay1"/>
   <resolve match="/*.groovy" name="testDisplay1" type="simple.test.TestDisplay1"/>
   <resolve match="/*.GROOVY" name="testDisplay1" type="simple.test.TestDisplay1"/>
   <resolve match="/*.do" name="testDisplay2" type="simple.test.TestDisplay2"/>
   <resolve match="/redirect1/*" name="testRedirect1" type="simple.test.TestRedirect1"/>
   <resolve match="/redirect2/*" name="testRedirect2" type="simple.test.TestRedirect2"/>
   <resolve match="/redirect3/*" name="testRedirect3" type="simple.test.TestRedirect3"/>
   <resolve match="/source/*" name="testSource1" type="simple.test.TestSource1"/>

</mapper>
